{
	"$schema": "./packages/quality/quality.schema.json",
	"root": ".",
	"sourceRoots": ["packages", "scripts"],
	"extensions": [".js", ".jsx", ".mjs", ".cjs", ".ts", ".tsx", ".mts", ".cts"],
	"tools": { "eslint": "eslint", "knip": "knip", "prettier": "prettier" },
	"oneLineImports": true,
	"singleUse": { "skippedDirectories": ["packages/quality", "packages/reporting"] },
	"renameExports": true,
	"prettierPrintWidth": 200,
	"qualityCommands": [
		{ "name": "build", "command": "pnpm", "args": ["run", "build"] },
		{ "name": "test", "command": "pnpm", "args": ["run", "test"] }
	],
	"documentation": {"required":{"types":true,"functions":true,"exportedFunctions":true,"noInlineFunctions":false}},
	"enabledChecks": {"format":true,"lint":true,"knip":true,"type":true,"recommend":true,"name":true,"alias":true}
}
